"Filial;Empresa_Referencia;Regiao;Reajuste_Praticado;VA_Valor;PLR_Referencia;Data_Acordo;Principais_Clausulas"
"G1;Renault/Volvo/VW;Grande Curitiba;5.5%;R$ 1.200,00;R$ 28.000,00;2025-01;Foco em banco de horas e flexibilidade"
"G2;General Motors;Gravataí;5.8%;R$ 1.150,00;R$ 22.000,00;2025-02;Reajuste acima do INPC"
"G3;Stellantis (Fiat)/Iveco;Betim;6.0%;R$ 1.100,00;R$ 19.500,00;2025-01;Garantia de emprego por 12 meses"
"G4;Hyundai/Piracicaba;Piracicaba;5.3%;R$ 1.300,00;R$ 20.000,00;2024-12;Aumento real de 1%"
"G5;Mercedes/Scania/Toyota;ABC Paulista;6.2%;R$ 1.400,00;R$ 32.000,00;2025-03;Redução de jornada sem redução salarial"
